<?xml version="1.0" encoding="UTF-8"?>
<!DOCTYPE DBGrids SYSTEM "../dbgrid.dtd" >
<DBGrids>
	<!-- 等待本辖区进行“确认接收”或者“确认迁出”的妇女列表 -->
	<DBGrid>
	<grid-title>迁移变动列表</grid-title>
		<grid-name>/woman_manage/batch_handle/approval_move/moveApprovalSearch
		</grid-name>
		<grid-table>
			 MOVE_RECORD m
			left join V_MASTER_WOMAN w on (w.id=m.WOMAN_ID)
			left join S_CODE sc on (SC.code=m.STATE)
			left join org o on (o.id=m.receive_org_id)
			left join org o1 on (o1.id=m.send_org_id)
		</grid-table>		
		<grid-cols>
			m.id mid,m.woman_id wid,w.name wname,w.id_No widNo,o1.name sendOrgName ,m.SEND_DATE ,o.name,
			m.receive_date,m.state,sc.name scname
		</grid-cols>
		<grid-label>ID$h,womanId$h,妇女姓名,妇女身份证号,迁出单位,迁出日期$d1,接收单位,接收日期$d1,状态$h,状态</grid-label>
		<grid-fields>id,womanid,womanName,wIdNo,sendOrg,sendDate,receiveOrg,receiveDate,moveState,scname</grid-fields>
		<grid-relation> ((o.inner_code like #user.employee.org.innerCode || '%'
			and (m.state	= 'RECEIVE_APPLY' )) or (o1.inner_code like #user.employee.org.innerCode || '%'
			and (m.state	= 'SEND_APPLY' )))
		</grid-relation>
		<grid-condCols>W.NAME,W.ID_NO</grid-condCols>
		<grid-param>womanName,womanIdNo</grid-param>
		<grid-operation>10,10</grid-operation>
		<grid-orderBy>m.id</grid-orderBy>
		<grid-rowsPerPage>10</grid-rowsPerPage>
	</DBGrid>
	
	<!-- 迁卡结果查询 -->
	<DBGrid>
	<grid-title>迁卡结果列表</grid-title>
		<grid-name>/woman_manage/batch_handle/approval_move/migrationCardResultQuery
		</grid-name>
		<grid-table>
			 MOVE_RECORD m left join
			V_MASTER_WOMAN w on (w.id=m.WOMAN_ID) left join
			ORG o2 ON (o2.id = w.MANAGE_UNIT_ID) LEFT JOIN
			EMPLOYEE send_e ON (send_e.id = m.SEND_EMPLOYEE_ID) LEFT JOIN
			org o1 on (o1.id=m.send_org_id) LEFT JOIN
			org o on (o.id=m.receive_org_id) LEFT JOIN
			EMPLOYEE receive_e ON (receive_e.id = m.RECEIVE_EMPLOYEE_ID) LEFT JOIN
			S_CODE sc on (SC.code=m.STATE)
		</grid-table>		
		<grid-cols>
		    m.id id,w.id womanid,w.name wname, w.id_No widNo,o1.name sendOrg,m.SEND_DATE sendDate,send_e.name sendEY,o.name receiveOrg,
			m.RECEIVE_DATE receiveDate,receive_e.name receiveEY,sc.name scname
		</grid-cols>
		<grid-label>ID$h,womanId$h,妇女姓名,妇女身份证号,迁出单位,迁出日期$d1,迁出操作人,接收单位,接收日期$d1,迁入操作人,状态</grid-label>
		<grid-fields>id,womanid,wname,wIdNo,sendOrg,sendDate,sendEY,receiveOrg,receiveDate,receiveEY,scname</grid-fields>
		<grid-relation> 
			 ((o.inner_code like #user.employee.org.innerCode || '%'
			and (m.state = 'SEND_APPLY' )) or (o1.inner_code like #user.employee.org.innerCode || '%'
			and (m.state = 'RECEIVE_APPLY' )))
		</grid-relation>
		<grid-condCols>W.NAME,W.ID_NO</grid-condCols>
		<grid-param>womanName,womanIdNo</grid-param>
		<grid-operation>10,10</grid-operation>
		<grid-orderBy>m.id</grid-orderBy>
		<grid-rowsPerPage>10</grid-rowsPerPage>
	</DBGrid>
	
	<!-- 历史查询 -->
	<DBGrid>
	<grid-title>历史迁卡列表</grid-title>
		<grid-name>/woman_manage/batch_handle/approval_move/migrationCardHistoryQuery
		</grid-name>
		<grid-table>
			MOVE_RECORD m left join
			V_MASTER_WOMAN w on (w.id=m.WOMAN_ID) left join
			ORG o2 ON (o2.id = w.MANAGE_UNIT_ID) LEFT JOIN
			EMPLOYEE send_e ON (send_e.id = m.SEND_EMPLOYEE_ID) LEFT JOIN
			org o1 on (o1.id=m.send_org_id) LEFT JOIN
			org o on (o.id=m.receive_org_id) LEFT JOIN
			EMPLOYEE receive_e ON (receive_e.id = m.RECEIVE_EMPLOYEE_ID) LEFT JOIN
			S_CODE sc on (SC.code=m.STATE)
		</grid-table>		
		<grid-cols>
		    m.id id,w.id womanid,w.name wname, w.id_No widNo,o1.name sendOrg,m.SEND_DATE sendDate,send_e.name sendEY,o.name receiveOrg,
			m.RECEIVE_DATE receiveDate,receive_e.name receiveEY,sc.name scname
		</grid-cols>
		<grid-label>ID$h,womanId$h,妇女姓名,妇女身份证号,迁出单位,迁出日期$d1,迁出操作人,接收单位,接收日期$d1,迁入操作人,状态</grid-label>
		<grid-fields>id,womanid,wname,wIdNo,sendOrg,sendDate,sendEY,receiveOrg,receiveDate,receiveEY,scname</grid-fields>
		<grid-relation> 
			o2.inner_code LIKE #user.employee.org.innerCode || '%' AND (m.STATE != 'SEND_APPLY' OR m.STATE != 'RECEIVE_APPLY')
		</grid-relation>
		<grid-condCols>W.NAME,W.ID_NO</grid-condCols>
		<grid-param>womanName,womanIdNo</grid-param>
		<grid-operation>10,10</grid-operation>
		<grid-orderBy>m.id DESC</grid-orderBy>
		<grid-rowsPerPage>10</grid-rowsPerPage>
	</DBGrid>
	<!-- 等待本辖区进行“确认接收”的妇女列表 -->
	<!-- 显示转卡记录表中，状态为转出等待接收，接收单位为本辖区的记录 -->
	<DBGrid>
	<grid-title>迁入请求列表</grid-title>
		<grid-name>/woman_manage/batch_handle/approval_receive/moveReceiveApprovalSearch
		</grid-name>
		<grid-table>
			 MOVE_RECORD m
			left join V_COMMON_WOMAN w on (w.id=m.WOMAN_ID)
			left join S_CODE sc on (SC.code=m.STATE)
			left join org o on (o.id=m.receive_org_id)
		</grid-table>		
		<grid-cols>
			m.id mid,w.name wname,w.id_No widNo,o.name oname,m.SEND_DATE mdate
		</grid-cols>
		<grid-label>ID$h,妇女姓名,妇女身份证号,原管理单位,原管理单位转卡日期$d1</grid-label>
		<grid-fields>id,womanName,wIdNo,sendRemark,sendDate</grid-fields>
		<grid-relation> o.inner_code like #user.employee.org.innerCode || '%'
			and m.state	= 'RECEIVE_APPLY'
		</grid-relation>
		<grid-condCols>W.NAME,W.ID_NO</grid-condCols>
		<grid-param>womanName,womanIdNo</grid-param>
		<grid-operation>10,10</grid-operation>
		<grid-orderBy>m.id</grid-orderBy>
		<grid-rowsPerPage>10</grid-rowsPerPage>
	</DBGrid>
	<!-- 等待本辖区进行确认迁出的妇女列表-->
	<DBGrid>
	<grid-title>迁出请求列表</grid-title>
		<grid-name>/woman_manage/batch_handle/approval_send/moveSendApprovalSearch</grid-name>
		<grid-table>
			move_record m
			left join V_COMMON_WOMAN w on (w.id=m.WOMAN_ID)
			left join org o on (o.id=m.RECEIVE_ORG_ID)
			left join org wo on ( wo.id=w.manage_unit_id)
		</grid-table>
		
		<grid-cols>
			m.id mid,w.name wname,w.id_No widno,o.name oname,m.RECEIVE_DATE mdate
		</grid-cols>
		<grid-label>ID$h,妇女姓名,妇女身份证号,新管理单位,请求日期$d1,</grid-label>
		<grid-fields>id,womanName,widNo,orgName,date</grid-fields>
		<grid-relation>  m.state = 'SEND_APPLY' and wo.inner_code like #user.employee.org.innerCode || '%'
		</grid-relation>
		<grid-condCols>W.NAME,W.ID_NO</grid-condCols>
		<grid-param>womanName,womanIdNo</grid-param>
		<grid-operation>10,10</grid-operation>
		<grid-orderBy>m.id</grid-orderBy>
		<grid-rowsPerPage>10</grid-rowsPerPage>
	</DBGrid>
	<!-- 用于显示批量退出育龄期二级菜单提示的dbgrid-->
	<DBGrid>
	
		<grid-name>/woman_manage/batch_handle/childbearing_age/OutOfChildbearingAgeBatch</grid-name>		
		<grid-table>
				v_woman_nocomplete_transaction w
				left join org o on (o.id=w.MANAGE_UNIT_ID)
		</grid-table>
		<grid-cols>
			<!-- 			"ADD_MONTHS"(w.BIRTHDAY,600)表示在生日上加上600个月，也就是49年 就等于应该退出日期-->
				w.id WID,o.name oname,w.name wname,w.id_no widno,w.birthday birthday,
				"ADD_MONTHS"(w.BIRTHDAY,600) outdate
		</grid-cols>
		
		<grid-label>ID$h,管理单位,妇女姓名,妇女身份证号,妇女出生日期$d1,应退出日期$d1</grid-label>
		<grid-fields>id,oname,name,idNo,birthday,outdate</grid-fields>
		<grid-relation>w.MANAGEMENT_STATE = 'NORMAL' and  "ADD_MONTHS"(w.BIRTHDAY,600) &lt;= SYSDATE and o.INNER_CODE like #user.employee.org.innerCode || '%'
		</grid-relation>		
		<grid-orderBy>w.birthday,w.id</grid-orderBy>
		<grid-rowsPerPage>20</grid-rowsPerPage>
	</DBGrid>
	<!-- 用于批量退出育龄期页面的查询功能-->
	<DBGrid>
	<grid-title>批量退出育龄期列表</grid-title>
		<grid-name>/woman_manage/batch_handle/childbearing_age/OutOfChildbearingAgeBatchSearch</grid-name>		
		<grid-table>
				v_woman_nocomplete_transaction w
				left join org o on (o.id=w.MANAGE_UNIT_ID)
		</grid-table>
		<grid-cols>
			<!-- 			"ADD_MONTHS"(w.BIRTHDAY,600)表示在生日上加上600个月，也就是49年 就等于应该退出日期-->
				w.id WID,o.name oname,w.LIVING_NOW_ADDRESS livingName,w.name wname,'',w.id_no widno,w.birthday birthday,
				"ADD_MONTHS"(w.BIRTHDAY,600) outdate
		</grid-cols>
		
		<grid-label>ID$h,管理单位,现居住地址,妇女姓名,操作,妇女身份证号,妇女出生日期$d1,应退出日期$d1</grid-label>
		<grid-fields>id,oname,livingName,name,oper,idNo,birthday,outdate</grid-fields>
		<grid-relation>w.MANAGEMENT_STATE = 'NORMAL'  and o.INNER_CODE like #user.employee.org.innerCode || '%'
		</grid-relation>				
		<grid-condCols>w.name,w.id_No,"ADD_MONTHS"(w.BIRTHDAY^600)$d,"ADD_MONTHS"(w.BIRTHDAY^600)$d</grid-condCols>
		<grid-param>womanName,womanIdNo,startDate,endDate</grid-param>	
		<grid-operation>10,10,4,6</grid-operation>
		<grid-orderBy>w.birthday,w.id</grid-orderBy>
		<grid-rowsPerPage>10</grid-rowsPerPage>
	</DBGrid>
</DBGrids>